{
  "localPreviewContractVersion": "0.2",
  "status": "approved",
  "audience": "developmentOnly",
  "webSocketSubprotocol": "mosaic.local-preview.v0.2",
  "previewProtocolVersion": "0.2",
  "fileFormatVersion": "0.2",
  "documentProtocol": {
    "schemaVersion": "0.2",
    "compatibilityManifest": "../../compatibility/v0.2.json"
  },
  "schemas": {
    "previewMessage": "../../schema/local-preview/v0.2/preview-message.schema.json",
    "localProject": "../../schema/local-preview/v0.2/local-project.schema.json"
  },
  "canonicalFixtures": [
    "../../fixtures/local-preview/v0.2/accepted-revision-runtime-reset.json",
    "../../fixtures/local-preview/v0.2/local-project.json",
    "../../fixtures/local-preview/v0.2/session-flow.messages.json"
  ],
  "messageTypes": [
    "previewClientConnected",
    "previewClientDisconnected",
    "capabilityReport",
    "draftUpdated",
    "draftAccepted",
    "draftRejected",
    "validationError",
    "renderWarning",
    "renderFailure",
    "mockCommerceStateChanged",
    "previewHeartbeat"
  ],
  "previewCapabilities": [
    {
      "name": "preview.liveUpdate",
      "version": "0.2"
    },
    {
      "name": "preview.mockCommerce",
      "version": "0.2"
    },
    {
      "name": "preview.localeOverride",
      "version": "0.2"
    },
    {
      "name": "preview.textScale",
      "version": "0.2"
    },
    {
      "name": "preview.diagnostics",
      "version": "0.2"
    }
  ],
  "deliveryDiagnosticCodes": [
    "preview.noMutualVersion",
    "preview.invalidNegotiation",
    "preview.invalidDraft",
    "preview.incompatibleSchemaVersion",
    "preview.invalidCapabilityReport",
    "preview.unsupportedPreviewCapability",
    "preview.unsupportedCapability",
    "preview.documentTooLarge"
  ],
  "revisionPolicy": {
    "documentAndMockCommerceOrdering": "independent",
    "acceptedRevisionRuntime": "resetNavigationCarouselSwitchAndSelection",
    "countdownOnAcceptance": "recomputeFromPreviewDeviceClock"
  },
  "readerPolicy": {
    "unsupportedSubprotocol": "rejectConnection",
    "unknownPreviewProtocolVersion": "rejectConnection",
    "unknownFileFormatVersion": "rejectLocalProject",
    "malformedCapabilityReport": "withholdDraftAtomically",
    "incompatibleSchemaVersion": "withholdDraftAtomically",
    "unsupportedDocumentCapability": "withholdDraftAtomically",
    "unsupportedPreviewCapability": "withholdDraftAtomically",
    "draftExceedsClientByteLimit": "withholdDraftAtomically",
    "invalidDraft": "withholdDraftAtomically",
    "rejectedRevision": "keepLastAcceptedDraft",
    "beforeFirstAcceptedRevision": "showConnectionStateWithoutBundledFallback",
    "mediaAndDesignTokenResolution": "neverPerformedByRelay",
    "portableExchange": "rawProtocol02Json"
  }
}
